type,text
ham,Hope you are having a good week. Just checking in
ham,K..give back my thanks.
ham,Am also doing in cbe only. But have to pay.
spam,"complimentary 4 STAR Ibiza Holiday or £10,000 cash needs your URGENT collection. 09066364349 NOW from Landline not to lose out! Box434SK38WP150PPM18+"
spam,okmail: Dear Dave this is your final notice to collect your 4* Tenerife Holiday or #5000 CASH award! Call 09061743806 from landline. TCs SAE Box326 CW25WX 150ppm
ham,Aiya we discuss later lar... Pick u up at 4 is it?
ham,Are you this much buzy
ham,Please ask mummy to call father
spam,Marvel Mobile Play the official Ultimate Spider-man game (£4.50) on ur mobile right now. Text SPIDER to 83338 for the game & we ll send u a FREE 8Ball wallpaper
ham,"fyi I'm at usf now, swing by the room whenever"
ham,"Sure thing big man. i have hockey elections at 6, shouldn€˜t go on longer than an hour though"
ham,I anything lor...
ham,"By march ending, i should be ready. But will call you for sure. The problem is that my capital never complete. How far with you. How's work and the ladies"
ham,"Hmm well, night night "
ham,K I'll be sure to get up before noon and see what's what
ham,Ha ha cool cool chikku chikku:-):-DB-)
ham,Darren was saying dat if u meeting da ge den we dun meet 4 dinner. Cos later u leave xy will feel awkward. Den u meet him 4 lunch lor.
ham,He dint tell anything. He is angry on me that why you told to abi.
ham,Up to u... u wan come then come lor... But i din c any stripes skirt...
spam,"U can WIN £100 of Music Gift Vouchers every week starting NOW Txt the word DRAW to 87066 TsCs www.ldew.com SkillGame,1Winaweek, age16.150ppermessSubscription"
ham,2mro i am not coming to gym machan. Goodnight.
ham,ARR birthday today:) i wish him to get more oscar.
ham,Reading gud habit.. Nan bari hudgi yorge pataistha ertini kano:-)
ham,"I sent my scores to sophas and i had to do secondary application for a few schools. I think if you are thinking of applying, do a research on cost also. Contact joke ogunrinde, her school is one me the less expensive ones"
ham,"Could you not read me, my Love ? I answered you"
ham,So what did the bank say about the money?
ham,Well if I'm that desperate I'll just call armand again
ham,"Fuuuuck I need to stop sleepin, sup"
ham,So how's the weather over there?
ham,Ok thanx...
ham,Ok.ok ok..then..whats ur todays plan
ham,1Apple/Day=No Doctor. 1Tulsi Leaf/Day=No Cancer. 1Lemon/Day=No Fat. 1Cup Milk/day=No Bone Problms 3 Litres Watr/Day=No Diseases Snd ths 2 Whom U Care..:-)
ham,"Sorry, I'll call later"
ham,Will do. Was exhausted on train this morning. Too much wine and pie. You sleep well too
spam,U have won a nokia 6230 plus a free digital camera. This is what u get when u win our FREE auction. To take part send NOKIA to 83383 now. POBOX114/14TCR/W1 16
ham,Ron say fri leh. N he said ding tai feng cant make reservations. But he said wait lor.
ham,"Call me when you/carlos is/are here, my phone's vibrate is acting up and I might not hear texts"
ham,Oh k :)why you got job then whats up?
spam,"SPJanuary Male Sale! Hot Gay chat now cheaper, call 08709222922. National rate from 1.5p/min cheap to 7.8p/min peak! To stop texts call 08712460324 (10p/min)"
ham,Yeah you should. I think you can use your gt atm now to register. Not sure but if there's anyway i can help let me know. But when you do be sure you are ready.
ham,Nationwide auto centre (or something like that) on Newport road. I liked them there
ham,He is there. You call and meet him
ham,Yeah sure I'll leave in a min
spam,URGENT! Your Mobile number has been awarded with a £2000 prize GUARANTEED. Call 09061790121 from land line. Claim 3030. Valid 12hrs only 150ppm
ham,"Mah b, I'll pick it up tomorrow"
ham,Then she dun believe wat?
ham,I've sent u my part..
ham,Hey so whats the plan this sat? 
ham,Can you just come in for a sec? There's somebody here I want you to see
ham,Yup. Izzit still raining heavily cos i'm in e mrt i can't c outside.
ham,"I think we're going to finn's now, come"
ham,Our Prasanth ettans mother passed away last night. Just pray for her and family.
ham,"Enjoy the showers of possessiveness poured on u by ur loved ones, bcoz in this world of lies, it is a golden gift to be loved truly.."
ham,He's really into skateboarding now despite the fact that he gets thrown off of it and winds up with bandages all over his arms every five minutes
ham,You please give us connection today itself before  DECIMAL  or refund the bill
spam,Congratulations ur awarded 500 of CD vouchers or 125gift guaranteed & Free entry 2 100 wkly draw txt MUSIC to 87066 TnCs www.Ldew.com1win150ppmx3age16
ham,Mum not going robinson already.
ham,Got meh... When?
ham,We are both fine. Thanks
ham,"awesome, how do I deal with the gate? Charles told me last night but, uh, yeah"
ham,"I thought i'd get him a watch, just cos thats the kind of thing u get4an18th. And he loves so much!"
ham,Have a safe trip to Nigeria. Wish you happiness and very soon company to share moments with
ham,Hey! do u fancy meetin me at 4 at cha – hav a lil beverage on me. if not txt or ring me and we can meet up l8r. quite tired got in at 3 v.pist ;) love Pete x x x
ham,"no, i *didn't* mean to post it. I wrote it, and like so many other times i've ritten stuff to you, i let it sit there. it WAS what i was feeling at the time. I was angry. Before i left, i hit send, then stop. It wasn't there. I checked on my phone when i got to my car. It wasn't there. You said you didn't sleep, you were bored. So why wouldn't THAT be the time to clean, fold laundry, etc.? At least make the bed?"
ham,"If you want to mapquest it or something look up usf dogwood drive, that's the tiny street where the parking lot is"
ham,"Ha ha nan yalrigu heltini..Iyo kothi chikku, u shared many things wit me..so far i didn't told any body and even uttered a word abt u.. If ur trusting me so much how can i tell these to others.. Plz nxt time dont use those words to me..ok, chikku:-);-)B-)"
ham,Becoz its  #  jan whn al the post ofice is in holiday so she cn go fr the post ofice...got it duffer
ham,Good. do you think you could send me some pix? I would love to see your top and bottom...
ham,Beautiful Truth against Gravity.. Read carefully: Our heart feels light when someone is in it.. But it feels very heavy when someone leaves it.. GOOD NIGHT
ham,"Buzz! Hey, my Love ! I think of you and hope your day goes well. Did you sleep in ? I miss you babe. I long for the moment we are together again*loving smile*"
ham,Lara said she can loan me  # .
ham,Dunno leh cant remember mayb lor. So wat time r we meeting tmr?
ham,So wats ur opinion abt him and how abt is character?
ham,Oh oh... Wasted... Den muz chiong on sat n sun liao...
ham,Are you at work right now ?
ham,Bring home some Wendy =D
ham,Ok going to sleep. Hope i can meet her.
ham,Allo! We have braved the buses and taken on the trains and triumphed. I mean we€˜re in b€˜ham. Have a jolly good rest of week
ham,Hmmm:)how many players selected?
ham,You flippin out yet?
ham,Your board is working fine. The issue of overheating is also reslove. But still software inst is pending. I will come around 8'o clock.
spam,URGENT! Your Mobile number has been awarded with a £2000 prize GUARANTEED. Call 09061790121 from land line. Claim 3030. Valid 12hrs only 150ppm
spam,1000's of girls many local 2 u who r virgins 2 this & r ready 2 4fil ur every sexual need. Can u 4fil theirs? text CUTE to 69911(£1.50p. m)
ham,"Nope. Since ayo travelled, he has forgotten his guy"
ham,Hey tmr maybe can meet you at yck
ham,Ok i'm coming home now.
ham,u called dad oredi...
ham,"Alright, I'll head out in a few minutes, text me where to meet you"
ham,*deep sigh* ... I miss you :-( ... I am really surprised you haven't gone to the net cafe yet to get to me ... Don't you miss me?
ham,Will be office around 4 pm. Now i am going hospital.
spam,ASKED 3MOBILE IF 0870 CHATLINES INCLU IN FREE MINS. INDIA CUST SERVs SED YES. L8ER GOT MEGA BILL. 3 DONT CARE. BAILIFF DUE IN DAYS. I O £250 3 WANT £800
ham,Yup bathe liao...
ham,I am getting threats from your sales executive Shifad as i raised complaint against him. Its an official message.
ham,S.this will increase the chance of winning.
ham,How are you doing. How's the queen. Are you going for the royal wedding
ham,Dear reached railway. What happen to you
ham,Probably gonna swing by in a wee bit
ham,K k pa Had your lunch aha.
ham,Whom you waited for yesterday
spam,"Urgent Urgent! We have 800 FREE flights to Europe to give away, call B4 10th Sept & take a friend 4 FREE. Call now to claim on 09050000555. BA128NNFWFLY150ppm"
spam,"For ur chance to win a £250 wkly shopping spree TXT: SHOP to 80878. T's&C's www.txt-2-shop.com custcare 08715705022, 1x150p/wk"
ham,Ok give me 5 minutes I think I see her. BTW you're my alibi. You were cutting my hair the whole time.
ham,At home by the way
